{
  "bench_version": "1.0",
  "example": true,
  "label": "example-harness-b",
  "agent": "codex",
  "model": "openai/example-model",
  "harness_commit": "0000000",
  "dataset_commit": "2fd12b88aafdd04a52c298e3940bcb189f9766d6",
  "harbor_version": "0.24.0",
  "date": "2026-10-12",
  "runs": [
    {
      "task_id": "fix-ocaml-gc",
      "trial": "fix-ocaml-gc__ex0",
      "reward": 0.0,
      "error": null,
      "input_tokens": 259298,
      "cache_tokens": null,
      "output_tokens": 11002,
      "cost_usd": 0.376,
      "wall_sec": 1553.2
    },
    {
      "task_id": "fix-ocaml-gc",
      "trial": "fix-ocaml-gc__ex1",
      "reward": 0.0,
      "error": null,
      "input_tokens": 523104,
      "cache_tokens": null,
      "output_tokens": 21487,
      "cost_usd": 0.845,
      "wall_sec": 1210.2
    },
    {
      "task_id": "fix-ocaml-gc",
      "trial": "fix-ocaml-gc__ex2",
      "reward": 0.0,
      "error": null,
      "input_tokens": 366076,
      "cache_tokens": null,
      "output_tokens": 33224,
      "cost_usd": 0.875,
      "wall_sec": 1505.5
    },
    {
      "task_id": "regex-chess",
      "trial": "regex-chess__ex0",
      "reward": 0.0,
      "error": null,
      "input_tokens": 733795,
      "cache_tokens": null,
      "output_tokens": 29383,
      "cost_usd": 0.79,
      "wall_sec": 967.3
    },
    {
      "task_id": "regex-chess",
      "trial": "regex-chess__ex1",
      "reward": 0.0,
      "error": null,
      "input_tokens": 237669,
      "cache_tokens": null,
      "output_tokens": 6798,
      "cost_usd": 0.628,
      "wall_sec": 1697.8
    },
    {
      "task_id": "regex-chess",
      "trial": "regex-chess__ex2",
      "reward": 0.0,
      "error": null,
      "input_tokens": 644188,
      "cache_tokens": null,
      "output_tokens": 39455,
      "cost_usd": 0.448,
      "wall_sec": 566.2
    },
    {
      "task_id": "write-compressor",
      "trial": "write-compressor__ex0",
      "reward": 0.0,
      "error": null,
      "input_tokens": 385304,
      "cache_tokens": null,
      "output_tokens": 26308,
      "cost_usd": 0.456,
      "wall_sec": 1065.3
    },
    {
      "task_id": "write-compressor",
      "trial": "write-compressor__ex1",
      "reward": 0.0,
      "error": null,
      "input_tokens": 738692,
      "cache_tokens": null,
      "output_tokens": 16917,
      "cost_usd": 1.196,
      "wall_sec": 968.5
    },
    {
      "task_id": "write-compressor",
      "trial": "write-compressor__ex2",
      "reward": 0.0,
      "error": null,
      "input_tokens": 750885,
      "cache_tokens": null,
      "output_tokens": 28871,
      "cost_usd": 1.011,
      "wall_sec": 830.7
    },
    {
      "task_id": "circuit-fibsqrt",
      "trial": "circuit-fibsqrt__ex0",
      "reward": 0.0,
      "error": null,
      "input_tokens": 667422,
      "cache_tokens": null,
      "output_tokens": 15563,
      "cost_usd": 1.159,
      "wall_sec": 899.8
    },
    {
      "task_id": "circuit-fibsqrt",
      "trial": "circuit-fibsqrt__ex1",
      "reward": 0.0,
      "error": null,
      "input_tokens": 886723,
      "cache_tokens": null,
      "output_tokens": 39757,
      "cost_usd": 0.525,
      "wall_sec": 718.7
    },
    {
      "task_id": "circuit-fibsqrt",
      "trial": "circuit-fibsqrt__ex2",
      "reward": 0.0,
      "error": null,
      "input_tokens": 740427,
      "cache_tokens": null,
      "output_tokens": 28194,
      "cost_usd": 0.896,
      "wall_sec": 982.0
    },
    {
      "task_id": "feal-linear-cryptanalysis",
      "trial": "feal-linear-cryptanalysis__ex0",
      "reward": 0.0,
      "error": null,
      "input_tokens": 567814,
      "cache_tokens": null,
      "output_tokens": 34920,
      "cost_usd": 0.738,
      "wall_sec": 632.7
    },
    {
      "task_id": "feal-linear-cryptanalysis",
      "trial": "feal-linear-cryptanalysis__ex1",
      "reward": 0.0,
      "error": null,
      "input_tokens": 374136,
      "cache_tokens": null,
      "output_tokens": 22572,
      "cost_usd": 0.996,
      "wall_sec": 1019.6
    },
    {
      "task_id": "feal-linear-cryptanalysis",
      "trial": "feal-linear-cryptanalysis__ex2",
      "reward": 0.0,
      "error": null,
      "input_tokens": 728743,
      "cache_tokens": null,
      "output_tokens": 38931,
      "cost_usd": 0.757,
      "wall_sec": 1223.7
    },
    {
      "task_id": "sparql-university",
      "trial": "sparql-university__ex0",
      "reward": 0.0,
      "error": null,
      "input_tokens": 417913,
      "cache_tokens": null,
      "output_tokens": 37040,
      "cost_usd": 0.761,
      "wall_sec": 1701.2
    },
    {
      "task_id": "sparql-university",
      "trial": "sparql-university__ex1",
      "reward": 0.0,
      "error": null,
      "input_tokens": 279036,
      "cache_tokens": null,
      "output_tokens": 27377,
      "cost_usd": 0.953,
      "wall_sec": 1661.5
    },
    {
      "task_id": "sparql-university",
      "trial": "sparql-university__ex2",
      "reward": 1.0,
      "error": null,
      "input_tokens": 311313,
      "cache_tokens": null,
      "output_tokens": 8850,
      "cost_usd": 0.817,
      "wall_sec": 373.4
    },
    {
      "task_id": "sam-cell-seg",
      "trial": "sam-cell-seg__ex0",
      "reward": 0.0,
      "error": null,
      "input_tokens": 311427,
      "cache_tokens": null,
      "output_tokens": 39233,
      "cost_usd": 0.423,
      "wall_sec": 698.8
    },
    {
      "task_id": "sam-cell-seg",
      "trial": "sam-cell-seg__ex1",
      "reward": 0.0,
      "error": null,
      "input_tokens": 263318,
      "cache_tokens": null,
      "output_tokens": 32716,
      "cost_usd": 1.108,
      "wall_sec": 1439.1
    },
    {
      "task_id": "sam-cell-seg",
      "trial": "sam-cell-seg__ex2",
      "reward": 1.0,
      "error": null,
      "input_tokens": 577716,
      "cache_tokens": null,
      "output_tokens": 16264,
      "cost_usd": 0.525,
      "wall_sec": 335.2
    },
    {
      "task_id": "make-doom-for-mips",
      "trial": "make-doom-for-mips__ex0",
      "reward": 1.0,
      "error": null,
      "input_tokens": 270743,
      "cache_tokens": null,
      "output_tokens": 6660,
      "cost_usd": 0.337,
      "wall_sec": 1677.9
    },
    {
      "task_id": "make-doom-for-mips",
      "trial": "make-doom-for-mips__ex1",
      "reward": 0.0,
      "error": null,
      "input_tokens": 333994,
      "cache_tokens": null,
      "output_tokens": 15296,
      "cost_usd": 0.961,
      "wall_sec": 1084.6
    },
    {
      "task_id": "make-doom-for-mips",
      "trial": "make-doom-for-mips__ex2",
      "reward": 1.0,
      "error": null,
      "input_tokens": 818091,
      "cache_tokens": null,
      "output_tokens": 7828,
      "cost_usd": 1.015,
      "wall_sec": 671.7
    },
    {
      "task_id": "make-mips-interpreter",
      "trial": "make-mips-interpreter__ex0",
      "reward": 0.0,
      "error": null,
      "input_tokens": 204399,
      "cache_tokens": null,
      "output_tokens": 27557,
      "cost_usd": 1.145,
      "wall_sec": 1241.6
    },
    {
      "task_id": "make-mips-interpreter",
      "trial": "make-mips-interpreter__ex1",
      "reward": 0.0,
      "error": null,
      "input_tokens": 499920,
      "cache_tokens": null,
      "output_tokens": 27099,
      "cost_usd": 0.74,
      "wall_sec": 762.6
    },
    {
      "task_id": "make-mips-interpreter",
      "trial": "make-mips-interpreter__ex2",
      "reward": 0.0,
      "error": null,
      "input_tokens": 834551,
      "cache_tokens": null,
      "output_tokens": 7999,
      "cost_usd": 1.112,
      "wall_sec": 1433.5
    },
    {
      "task_id": "feal-differential-cryptanalysis",
      "trial": "feal-differential-cryptanalysis__ex0",
      "reward": 0.0,
      "error": null,
      "input_tokens": 360909,
      "cache_tokens": null,
      "output_tokens": 35984,
      "cost_usd": 1.163,
      "wall_sec": 440.2
    },
    {
      "task_id": "feal-differential-cryptanalysis",
      "trial": "feal-differential-cryptanalysis__ex1",
      "reward": 0.0,
      "error": null,
      "input_tokens": 307006,
      "cache_tokens": null,
      "output_tokens": 6586,
      "cost_usd": 0.703,
      "wall_sec": 1612.1
    },
    {
      "task_id": "feal-differential-cryptanalysis",
      "trial": "feal-differential-cryptanalysis__ex2",
      "reward": 1.0,
      "error": null,
      "input_tokens": 813370,
      "cache_tokens": null,
      "output_tokens": 30752,
      "cost_usd": 0.738,
      "wall_sec": 791.9
    }
  ],
  "summary": {
    "pass_rate": 0.1667,
    "per_task": {
      "fix-ocaml-gc": "0/3",
      "regex-chess": "0/3",
      "write-compressor": "0/3",
      "circuit-fibsqrt": "0/3",
      "feal-linear-cryptanalysis": "0/3",
      "sparql-university": "1/3",
      "sam-cell-seg": "1/3",
      "make-doom-for-mips": "2/3",
      "make-mips-interpreter": "0/3",
      "feal-differential-cryptanalysis": "1/3"
    },
    "total_input_tokens": 15207982,
    "total_output_tokens": 720623,
    "total_cost_usd": 24.2,
    "total_wall_sec": 31766.5
  }
}