{
  "bench_version": "1.0",
  "label": "harness-codex-gpt-6.1-sol",
  "agent": "bench.agents.local_harness_codex:LocalHarnessCodex",
  "model": "openai/gpt-6.1-sol",
  "harness_commit": "75c3c9cca1dba2eb8ca1c35825cb2a7a6b9169a5",
  "dataset_commit": "2fd12b88aafdd04a52c298e3940bcb189f9766d6",
  "harbor_version": "0.24.0",
  "date": "2026-10-14",
  "runs": [
    {
      "task_id": "circuit-fibsqrt",
      "trial": "circuit-fibsqrt__vV45zCh",
      "reward": 1.0,
      "error": null,
      "input_tokens": 284386,
      "cache_tokens": 247680,
      "output_tokens": 3531,
      "cost_usd": 0.13349,
      "wall_sec": 528.9201
    },
    {
      "task_id": "feal-differential-cryptanalysis",
      "trial": "feal-differential-cryptanalysis__fHeAi8e",
      "reward": 1.0,
      "error": null,
      "input_tokens": 158956,
      "cache_tokens": 144128,
      "output_tokens": 1379,
      "cost_usd": 0.0578588,
      "wall_sec": 521.390639
    },
    {
      "task_id": "feal-linear-cryptanalysis",
      "trial": "feal-linear-cryptanalysis__gkAEXGg",
      "reward": 1.0,
      "error": null,
      "input_tokens": 250992,
      "cache_tokens": 177664,
      "output_tokens": 3803,
      "cost_usd": 0.2024524,
      "wall_sec": 578.586264
    },
    {
      "task_id": "fix-ocaml-gc",
      "trial": "fix-ocaml-gc__KcBrs3z",
      "reward": 1.0,
      "error": null,
      "input_tokens": 386769,
      "cache_tokens": 347776,
      "output_tokens": 2752,
      "cost_usd": 0.1402836,
      "wall_sec": 1308.708598
    },
    {
      "task_id": "make-doom-for-mips",
      "trial": "make-doom-for-mips__y7tZmZ5",
      "reward": 0.0,
      "error": "AgentTimeoutError",
      "input_tokens": 533315,
      "cache_tokens": 494976,
      "output_tokens": 3669,
      "cost_usd": 0.16286559999999997,
      "wall_sec": 1117.207516
    },
    {
      "task_id": "make-mips-interpreter",
      "trial": "make-mips-interpreter__ByaZyJ3",
      "reward": 0.0,
      "error": null,
      "input_tokens": 728863,
      "cache_tokens": 656768,
      "output_tokens": 5625,
      "cost_usd": 0.26611679999999993,
      "wall_sec": 1211.151072
    },
    {
      "task_id": "regex-chess",
      "trial": "regex-chess__LCaowYv",
      "reward": 1.0,
      "error": null,
      "input_tokens": 352296,
      "cache_tokens": 321920,
      "output_tokens": 4393,
      "cost_usd": 0.13687400000000002,
      "wall_sec": 621.985887
    },
    {
      "task_id": "sam-cell-seg",
      "trial": "sam-cell-seg__TR3u5Hj",
      "reward": 0.0,
      "error": null,
      "input_tokens": 313904,
      "cache_tokens": 277120,
      "output_tokens": 2194,
      "cost_usd": 0.12322,
      "wall_sec": 1221.751279
    },
    {
      "task_id": "sparql-university",
      "trial": "sparql-university__23SG6rT",
      "reward": 1.0,
      "error": null,
      "input_tokens": 230043,
      "cache_tokens": 175872,
      "output_tokens": 1650,
      "cost_usd": 0.1424292,
      "wall_sec": 319.811521
    },
    {
      "task_id": "write-compressor",
      "trial": "write-compressor__d4iHuUW",
      "reward": 1.0,
      "error": null,
      "input_tokens": 239991,
      "cache_tokens": 213888,
      "output_tokens": 3184,
      "cost_usd": 0.10543480000000001,
      "wall_sec": 261.252704
    }
  ],
  "summary": {
    "pass_rate": 0.7,
    "per_task": {
      "circuit-fibsqrt": "1/1",
      "feal-differential-cryptanalysis": "1/1",
      "feal-linear-cryptanalysis": "1/1",
      "fix-ocaml-gc": "1/1",
      "make-doom-for-mips": "0/1",
      "make-mips-interpreter": "0/1",
      "regex-chess": "1/1",
      "sam-cell-seg": "0/1",
      "sparql-university": "1/1",
      "write-compressor": "1/1"
    },
    "total_input_tokens": 3479515,
    "total_output_tokens": 32180,
    "total_cost_usd": 1.471,
    "total_wall_sec": 7690.8
  }
}